{
  "$schema": "https://puretokensx.com/schemas/task-receipt.schema.json",
  "schemaVersion": 1,
  "kind": "video",
  "machineReceipt": "executor JSON retains available model, operation, task identity, requested count, safe parameters, command and progress; do not rename or reconstruct these fields",
  "submission": {
    "requiredFields": [
      "task_id",
      "status"
    ],
    "nextAction": "Briefly state that the task was accepted; then wait only for this task."
  },
  "continuation": {
    "requiredFields": [
      "task_id",
      "status"
    ],
    "nextAction": "Follow next_step while preserving wait_windows_completed. A normal window ending is still processing, not a task failure; allow one more authorized foreground window, then ask. Errors and deferred retries stop automatic continuation."
  },
  "reconciliation": {
    "requiredFields": [
      "task_id",
      "reconciliation_required"
    ],
    "nextAction": "Explain that verification is required; retain this task and do not infer a refund or submit a replacement."
  },
  "completion": {
    "requiredFields": [
      "delivered_count"
    ],
    "nextAction": "Provide the actual attachment and note missing indexes if any; do not repeat the entire task receipt."
  },
  "failure": {
    "requiredFields": [
      "error_message",
      "next_action"
    ],
    "conditionalFields": {
      "task_id": "Retain a known task ID; never invent one.",
      "failure_phase": "Explain the phase when it changes the next action.",
      "http_status": "Only when returned and useful; otherwise omit.",
      "api_error_code": "Only the exact returned public code; otherwise omit.",
      "retry_after_seconds": "Only when returned and useful.",
      "support": "Only the existing allowlisted support block when the user requests private support; never the whole receipt, an automatic upload or an extra request. Request correlation is not task identity or idempotency.",
      "local_error_code": "Use the executor classification: task_response_unreadable, task_id_missing and task_id_invalid are distinct; an invalid ID does not mean the server omitted it. Preserve unknown submission and never repeat POST automatically."
    },
    "nextAction": "State what failed and the next safe action; unknown submission never authorizes automatic repetition."
  }
}
